{
  "schema_version": "2.0",
  "event_id": "e0e0e0e0-0000-5000-8000-000000000013",
  "event_type": "playout.channel.skip_requested",
  "timestamp": "2026-09-21T13:15:02.105Z",
  "payload": {
    "store_id": "f1e2d3c4-0000-4000-8000-000000000001",
    "channel_instance_id": "c0c0c0c0-0000-4000-8000-000000000001",
    "seq": 13,
    "occurred_at": "2026-09-21T13:16:01.002Z",
    "rid": 43,
    "item": {
      "media_id": "11110000-0000-4000-8000-00000000000b",
      "seq": 1,
      "family": "music",
      "hour_bucket": "2026-09-21T13:00:00Z",
      "schedule_revision": "sha256:abc",
      "format_clock_version": 3,
      "timezone": "Africa/Johannesburg",
      "duration_ms": 214000,
      "timing_rule": "soft",
      "start_offset_ms": null,
      "schedule": null
    }
  }
}
